{
  "schema_version": "1.0",
  "status": "partial",
  "started_at": "2026-10-14T05:00:00Z",
  "completed_at": "2026-10-14T05:00:01Z",
  "items": [
    {
      "schema_version": "1.0",
      "request_id": "req-example-001",
      "device_id": "dev-example-ac",
      "status": "verified",
      "started_at": "2026-10-14T05:00:00Z",
      "completed_at": "2026-10-14T05:00:01Z",
      "data": {
        "target_temperature": 26,
        "mode": "cool"
      },
      "error": null,
      "verification": {
        "kind": "state_match",
        "source": "lan",
        "observed_at": "2026-10-14T05:00:01Z",
        "received_at": "2026-10-14T05:00:01Z",
        "matches_target": true,
        "note": "Fictional observation. State match does not prove causality."
      },
      "attempts": [
        {
          "transport": "lan",
          "phase": "accepted",
          "duration_ms": 1000
        }
      ]
    },
    {
      "schema_version": "1.0",
      "request_id": "req-example-002",
      "device_id": "dev-example-ac-2",
      "status": "unknown",
      "started_at": "2026-10-14T05:00:00Z",
      "completed_at": "2026-10-14T05:00:01Z",
      "data": null,
      "error": {
        "code": "WRITE_OUTCOME_UNKNOWN",
        "message": "The request may have executed; no reliable acknowledgement was received.",
        "retryable": false,
        "suggested_action": "refresh_state",
        "details": {
          "stage": "sent",
          "transport": "lan"
        }
      },
      "verification": null,
      "attempts": [
        {
          "transport": "lan",
          "phase": "possibly_sent",
          "duration_ms": 1000
        }
      ]
    }
  ]
}
